Nome da Música,link,album,letra
A Carta,/djavan/a-carta.html,Ao Vivo - Vols. 1 e 2,"Não vá levar tudo tão a sério Sentindo que dá, deixa correr Se souber confiar no seu critério Nada a temer Não vá levar tudo tão na boa Brigue para obter o melhor Se errar por amor Deus abençoa Seja você  No que sua crença vacilou A flor da dúvida se abriu Vou ler a carta que o Biel mandou Pra você, lá do Brasil:  ""Eles me disseram tanta asneira, disseram só besteira Feito todo mundo diz. Eles me disseram que a coleira e um prato de ração Era tudo o que um cão sempre quis Eles me trouxeram a ratoeira com um queijo de primeira Que me, que me pegou pelo nariz Me deram uma gaiola como casa, amarraram minhas asas E disseram para eu ser feliz  Mas como eu posso ser feliz num poleiro? Como eu posso ser feliz sem pular ? Mas como eu posso ser feliz num viveiro, Se ninguém pode ser feliz sem voar?  Ah, segurei o meu pranto para transformar em canto E para meu espanto minha voz desfez os nós Que me apertavam tanto E já sem a corda no pescoço, sem as grades na janela E sem o peso das algemas na mão Eu encontrei a chave dessa cela Devorei o meu problema e engoli a solução Ah, se todo o mundo pudesse saber Como é fácil viver fora dessa prisão E descobrisse que a tristeza tem fim E a felicidade pode ser simples como um aperto de mão  É esse o vírus que eu sugiro que você contraia Na procura pela cura da loucura, Quem tiver cabeça dura vai morrer na praia."""
A Idade do Céu,/djavan/a-idade-do-ceu.html,,Não somos mais Que uma gota de luz Uma estrela que cai Uma fagulha tão só Na idade do céu  Não somos o que queríamos ser Somos um breve pulsar Em um silêncio antigo Com a idade do céu  Calma Tudo está em calma Deixe que o beijo dure Deixe que o tempo cure Deixe que a alma Tenha a mesma idade Que a idade do céu  Não somos mais Que um punhado de mar Uma piada de Deus Ou um capricho do sol No jardim do céu  Não damos pé Entre tanto tic tac Entre tanto Big Bang Somos um grão de sal No mar do céu  Calma Tudo está em calma Deixe que o beijo dure Deixe que o tempo cure Deixe que a alma Tenha a mesma idade Que a idade do céu A mesma idade Que a idade do céu
A Noiva da Cidade,/djavan/a-noiva-da-cidade.html,,"""Tutu-Marambá não venha mais cá Que a mãe da criança te manda matar"" ""Tutu-Marambá não venha mais cá Que a mãe da criança te manda matar""  Ai, como essa moça é descuidada Com a janela escancarada Quer dormir impunemente Ou será que a moça lá no alto Não escuta o sobressalto Do coração da gente  Ai, quanto descuido o dessa moça Que papai tá lá na roça E mamãe foi passear E todo marmanjo da cidade Quer entrar Nos versos da cantiga de ninar Pra ser um Tutu-Marambá  Ai, como essa moça é distraída Sabe lá se está vestida Ou se dorme transparente Ela sabe muito bem que quando adormece Está roubando O sono de outra gente  Ai, quanta maldade a dessa moça E, que aqui ninguém nos ouça Ela sabe enfeitiçar Pois todo malandro da cidade Quer entrar Nos sonhos que ela gosta de sonhar E ser um Tutu-Marambá  ""Boi, boi, boi, boi da cara preta Pega essa menina que tem medo de careta"""
A Rosa,/djavan/a-rosa.html,,"Arrasa o meu projeto de vida Querida, estrela do meu caminho Espinho cravado em minha garganta Garganta A santa às vezes troca meu nome E some  E some nas altas da madrugada Coitada, trabalha de plantonista Artista, é doida pela Portela Ói ela Ói ela, vestida de verde e rosa  A Rosa garante que é sempre minha Quietinha, saiu pra comprar cigarro Que sarro, trouxe umas coisas do Norte Que sorte Que sorte, voltou toda sorridente  Demente, inventa cada carícia Egípcia, me encontra e me vira a cara Odara, gravou meu nome na blusa Abusa, me acusa Revista os bolsos da calça  A falsa limpou a minha carteira Maneira, pagou a nossa despesa Beleza, na hora do bom me deixa, se queixa A gueixa Que coisa mais amorosa A Rosa  Ah, Rosa, e o meu projeto de vida? Bandida, cadê minha estrela guia Vadia, me esquece na noite escura Mas jura Me jura que um dia volta pra casa  Arrasa o meu projeto de vida Querida, estrela do meu caminho Espinho cravado em minha garganta Garganta A santa às vezes me chama Alberto Alberto  Decerto sonhou com alguma novela Penélope, espera por mim bordando Suando, ficou de cama com febre Que febre A lebre, como é que ela é tão fogosa A Rosa  A Rosa jurou seu amor eterno Meu terno ficou na tinturaria Um dia me trouxe uma roupa justa Me gusta, me gusta Cismou de dançar um tango  Meu rango sumiu lá da geladeira Caseira, seu molho é uma maravilha Que filha, visita a família em Sampa Às pampa, às pampa Voltou toda descascada  A fada, acaba com a minha lira A gira, esgota a minha laringe Esfinge, devora a minha pessoa À toa, a boa Que coisa mais saborosa A Rosa  Ah, Rosa, e o meu projeto de vida? Bandida, cadê minha estrela guia? Vadia, me esquece na noite escura Mas jura Me jura que um dia volta pra casa"
A Rota do Indivíduo (Ferrugem),/djavan/a-rota-do-individuo-ferrugem.html,Coisa De Acender,"Mera luz Que invade a tarde cinzenta E algumas folhas deitam sobre a estrada O frio é o agasalho Que esquenta O coração gelado Quando venta Movendo a água abandonada Restos de sonho Sobre um novo dia Amores nos vagões Vagões nos trilhos Parece que quem parte é a ferrovia Que mesmo não te vendo te vigia Como mãe, como mãe Que dorme olhando os filhos Com os olhos na estrada E no mistério solitário da penugem Vejo a vida correndo parada Como se não existisse chegada Na tarde distante Ferrugem ou nada   © 1991 Luanda Edições Musicais Ltda. GPA Edições Musicais LTDA"
Aboio Blues,/djavan/aboio-blues.html,,"Eu fui no céu buscar meu pai Pra mostrar a escravidão E a mulher que eu encontrei Disse: Eu sou dona do teu coração  Bem vindo, meu menino Pra nadar nesse mar que é meu No entanto, é preciso Que você me tire o véu  Lancei no ar potente chama Pra livrar sua visão Amor, não vá vir a delírio Me perder na imensidão  Te entrego meu destino Quero em ti permanecer Silêncio cristalino Suavíssimo dever  Homem, deite no meu leito E observe a amplidão Que vive dentro do teu peito Bem juntinho da solidão  Te juro, doce amada Nunca vi a vida assim Agora eu sei que tudo é nada Com você dentro de mim  Te deixo, oh semente novinha A brilhar na escuridão Espelho meu, dei-lhe o que tinha Somos um na multidão"
Açaí,/djavan/acai.html,Ao Vivo - Vols. 1 e 2,"Solidão de manhã, poeira tomando assento Rajada de vento, som de assombração, coração Sangrando toda palavra sã  A paixão puro afã, místico clã de sereia Castelo de areia, ira de tubarão, ilusão O sol brilha por sí  Açaí, guardiã Zum de bezouro um imã Branca é a tez da manhã"
Acelerou,/djavan/acelerou.html,"Djavan na Pista, Etc","Acelerou /Djavan  Ando tão perdido em meus pensamentos Longe já se vão os meus dias de paz Hoje com a lua clara brilhando Vejo que o que sinto por ti é mais  Quando te vi, aquilo era quase o amor Você me acelerou, acelerou, me deixou desigual Chegou pra mim, me deu um daqueles sinais Depois desacelerou e eu fiquei muito mais  Sempre esperarei por ti, chegue quando Sonho em teus braços dormir, descansar Venha e a vida pra você será boa Cedo que é pra gente se amar a mais  Quando te vi, aquilo era quase o amor Você me acelerou, acelerou, me deixou desigual Chegou pra mim, me deu um daqueles sinais Depois desacelerou e eu fiquei muito mais  Quando te vi, aquilo era quase o amor Você me acelerou, acelerou, me deixou desigual Chegou pra mim, me deu um daqueles sinais Depois desacelerou e eu fiquei muito mais  Muito mais perdido, quase um cara vencido À mercê de amigo ou coisa que o valha Você me enlouquece, você bem que merece 'inda me aparece de minissaia  Sério, o que eu vou fazer, eu te amo Nada do que é você em mim se desfaz Mesmo sem saber o teu sobrenome Creio que te amar é pra sempre mais  Quando te vi, aquilo era quase o amor Você me acelerou, acelerou, me deixou desigual Chegou pra mim, me deu um daqueles sinais Depois desacelerou e eu fiquei muito mais...    ________________________________________________________________"
Acerto de Contas,/djavan/acerto-de-contas.html,Rua dos Amores,"Com você vivi De verdade, Eu digo tarde. Mas sei Que foi sempre muito bom! Só fiz coisas tontas, Nesse acerto de contas Quem paga É o meu coração  Você é tudo O que eu sonhei Agora eu sei, Me faz de novo respirar Outra madrugada já passou E você nem lô, Devastando a cidade  O verde da mata é outra cor Ao sentir que estou Lhe perdendo Nada é mais, Não sei mais O que vou dizer, Só quero poder lhe provar, Mostrar pra você Que eu mudei! Me deixa voltar  Com você vivi De verdade, Eu digo tarde. Mas sei Que foi sempre muito bom! Só fiz coisas tontas, Nesse acerto de contas Quem paga É o meu coração  Você é tudo O que eu sonhei Agora eu sei, Me faz de novo respirar Outra madrugada já passou E você nem lô, Devastando a cidade  O verde da mata é outra cor Ao sentir que estou Lhe perdendo Nada é mais, Não sei mais O que vou dizer, Só quero poder lhe provar, Mostrar pra você Que eu mudei! Me deixa voltar  Outra madrugada já passou E você nem lô, Devastando a cidade  O verde da mata é outra cor Ao sentir que estou Lhe perdendo Nada é mais, Não sei mais O que vou dizer, Só quero poder lhe provar, Mostrar pra você Que eu mudei! Me deixa voltar  Não sei mais O que vou dizer, Só quero poder lhe provar, Mostrar pra você Que eu mudei! Me deixa voltar  Dizer, Quero poder provar, Mudei!"
Adorava Me Ver Como Seu,/djavan/adorava-me-ver-como-seu.html,Matizes,"Será que alguém Saberá dizer Vendo de fora Como é viver Longe da mulher Que a gente adora Não há festa que chegue Pra tristeza ceder lugar Não sei se alguém Pode mensurar O que perdi De tanto sonho Que cultivei E não vivi Adorava me ver como seu Sempre adorei mas não deu Das vezes que contei Com uma virada Nada tenho a dizer Só cabeçada Cansei Time empatou Com o Madureira Deus, o que foi que eu fiz? Nasci Pra ser o amor E ela mela o jogo Me teve E não me quis.   (fonte: site oficial)"
Água,/djavan/agua.html,Para Sempre: Djavan,"Tudo que se passa aqui Não passa de um naufrágio Eu me criei no mar E foi lá que aprendi a nadar Pra Nada Eu aprendi pra nada  A maré subiu demasiada E tudo aqui está que é água Que é água  Água pra encher Água pra manchar Água pra vazar a vida Água pra reter Água pra arrasar Água na minha comida  Água pra encher Água pra manchar Água pra vazar a vida Água pra reter Água pra arrasar Água na minha comida  Água, aguaceiro Águadouro Água que limpa o couro Couro até mata  Água, aguaceiro Águadouro Água que limpa o couro Couro até mata  Água, aguaceiro Águadouro Água que limpa o couro Couro até mata  Água, aguaceiro Águadouro Água que limpa o couro Couro até mata"
Água de Lua,/djavan/agua-de-lua.html,Novena,"Faca de ponta, peixeira Pau na moleira, espingarda Cano comprido estampido no ar Clarão da espada afiada A morte um dia há de chegar  Fogo cuspiu, labareda Flora no mato, vereda Prata boiando nas águas do luar Clarão da espada afiada A morte um dia há de chegar  Eu me criei no molhado Areia e pedras do lado Berço de uma sereia   © 1982 Luanda Edições Musicais Ltda."
Alagoas,/djavan/alagoas.html,,"Ô Maceió É três mulé prum homem só Ô Maceió É três mulé prum homem só Eu fui batizado na capela do farol Matriz de Santa Rita, Maceió Eu fui batizado na capela do farol Matriz de santa Rita, Maceió mas foi beirando estrada abaixo que eu piquei a mula Disposto a colar grau na escola da natura Se alguém me perguntar Não tenho nada a dizer Pois eu, pra me realizar Preciso morrer Mas foi beirando estrada abaixo que eu piquei a mula Disposto a colar um grau na escola da natura Se alguém me perguntar Não tenho nada a dizer Pois eu, pra me realizar preciso morrer Você me deu liberdade Pra meu destino escolher E quando sentir saudades Poder chorar por você Não vê, minha terra mãe Que estou a me lamentar É que eu fui condenado a viver do que cantar A--la, a--la, ala, Alagoas A--la, a--la, ala, Alagoas Eu fui batizado na capela do farol......  © 1978 BMG"
Alegre menina,/djavan/alegre-menina.html,Djavan - Novelas,"O que fizeste sultão de minha alegre menina? Palácio real lhe dei, um trono de pedraria Sapato bordado a ouro, esmeraldas e rubis Ametista para os dedos, vestidos de diamantes Escravas para serví-la, um lugar no meu dossel E a chamei de rainha, e a chamei de rainha O que fizeste sultão de minha alegre menina?  Só desejava campina, colher as flores do mato Só desejava um espelho de vidro prá se mirar Só desejava do sol calor para bem viver Só desejava o luar de prata prá repousar Só desejava o amor dos homens prá bem amar Só desejava o amor dos homens prá bem amar  No baile real levei-a, tua, alegre menina Vestida de realeza, com princesas conversou Com doutores praticou, dançou a dança faceira Bebeu o vinho mais caro, mordeu fruta estrangeira Entrou nos braços do rei, rainha mas verdadeira Entrou nos braços do rei, rainha mas verdadeira"
Além de Amar,/djavan/alem-de-amar.html,Milagreiro,Além de amar   Quero esquecer É como nódoa e não sai Nem pra fugir Sair já não me distrai Como extinguir As sobras de uma paixão Retidas no mais secreto vão  Tanto a dizer Mas tais palavras não saem Donas de si Para não me verem ruir me traem Eu me perdi e não sei como explicar O que foi que eu fiz além de amar  Ou é desamor ou é intriga Seja o que for Já nos desune Se é por amar que a gente briga Bem pode ser ciúme Mas tudo é pouco pra tanto sofrer Sem razão Pra convencer meu coração
Aliás,/djavan/alias.html,Novena,"Existem coisas que o amor diz Com aquela coisa a mais De quem é feliz Jóias caras produzidas no coração Tiaras sem fim Guardo essa luzes pra te servir  É tanta coisa que o amor faz Vem como um rio, em sua calma voraz Timidez mas, sabe voar Pra fugir da sombra do não-querer Ademais, quem é que quer sofrer?  Você, o sonho Meus pés, o chão Mesmo que bravo O mar vira na canção Mística rosa, ave rubra Meu Deus do céu da boca rubi Beijo esperado me leve a ti  É um sacrifício dizer um não Em seu ofício de obedecer à paixão Seja como for, sempre se faz por prazer Tudo o que o amor diz Aliás, quem não quer ser feliz?  É um sacrifício dizer um não Em seu ofício da obedecer à paixão Seja como for, sempre se faz por prazer Tudo o que o amor diz Aliás, quem não quer ser feliz?"
Álibi,/djavan/alibi.html,Para Sempre: Djavan,"Álibi  Havia mais que um desejo A força do beijo Por mais que vadia Não sacia mais  Meus olhos lacrimejam teu corpo Exposto à mentira do calor da ira No afã de um desejo que não contraíra No amor, a tortura está por um triz  Mas gente atura e até se mostra feliz Quando se tem o álibi De ter nascido ávido E convivido inválido Mesmo sem ter havido, havido  Quando se tem o álibi De ter nascido ávido E convivido inválido Mesmo sem ter havido, havido  Quando se tem o álibi De ter nascido ávido E convivido inválido Mesmo sem ter havido, havido  Havia mais que um desejo"
Alívio,/djavan/alivio.html,Coisa De Acender,Aturei andar de bar em bar; na contra-mão Pra Seguir a sua direção Vou na praia e todos são iguais; queimados ou não Sempre a procurar sem direção  Aturdido sem sentido Não sei onde vou Toda hora é como agora É viver só pra lhe esperar  Eu queria tanto descansar; o meu coração Uma nova má notícia não Seja lindo o amor bem vindo; e cresça o quanto for Me apareça e faça o seu gol  Pra eu respirar e ter alívio Nessa condição; vou poder me situar em seu convívio; tão colorido Quiçá no lado azul; preto branco qualquer cor Mas sempre vivo
Amar é Tudo,/djavan/amar-e-tudo.html,Ao Vivo - Vols. 1 e 2,"Meu amor Eu nem sei te dizer quanta dor Mesmo a noite não sabia O que o amor escondia Minha vida Que fazer com minh'alma perdida? Foi um raio de ilusão Bem no meu coração E veio com tudo Dissabor e tudo Veio com tudo Dissabor e tudo Eu sei, Eu não sei viver sem ela Assim, um simples talvez me desespera Ninguém pode querer bem sem ralar Não há nada o que fazer Amar é tudo.   © 1998 Luanda Edições Musicais Ltda."
Amor Algum,/djavan/amor-algum.html,Vaidade,"Lua, que vai pela noite Olha aqui pra mim Vira essa minha sorte E faz eu ser mais feliz Todas as estradas que andei Naum me trouxeram Jamais amor algum Me traz um E eu te apresentarei Ao céu azul Pra que eu não veja Nada sem cor E o sol raiar Sem amor Pra que eu não veja o tempo passar No desespero E nada de me apaixonar Não sobreviverei Serei fácl de achar Sem coleira, atacando Insensibilidade Tô pronto pra esbanjar Toda vez que eu for sair UaaU! Que delírio o meu O que eu quero é amar Nem que o amor não seja eu"
Amor de Índio,/djavan/amor-de-indio.html,,"Tudo que move é sagrado E remove as montanhas Com todo cuidado, meu amor Enquanto a chama arder Todo dia te ver passar Tudo viver a teu lado Com o arco da promessa No azul pintado pra durar  Abelha fazendo mel Vale o tempo que não voou A estrela caiu do céu O pedido que se pensou O destino que se cumpriu De sentir teu calor E ser todo  Todo dia é de viver Para ser o que for E ser tudo  Sim, todo amor é sagrado E o fruto do trabalho É mais que sagrado, meu amor A massa que faz o pão Vale a luz do teu suor Lembra que o sono é sagrado E alimenta de horizontes O tempo acordado de viver  No inverno te proteger No verão sair pra pescar No outono te conhecer Primavera poder gostar No estio me derreter Pra na chuva dançar E andar junto  O destino que se cumpriu De sentir teu calor E ser tudo"
Andaluz,/djavan/andaluz.html,Coisa De Acender,"ANDALUZ Djavan / Flavia Virginia   Estrela minha luz do dia abacate e mel cheiro de haxi tarde de frio beija-flor, flores na varanda se transam sombra de luz ui de amor frugal, casa azul babalaó, olorum, alá, dalai-lama vigiai governador porque o povo, virgem maria! Sai da janela se quer sonhar vem pra cama deus lhe fez viver pra me querer amor quase 2.000 salvaria a arara azul o circo é orfei vai lua, é dia deixa vir os raios de sol tens a noite longe de mim sevilha incensa o ar andaluz babalaó, olorum, alá, dalai-lama vigiai governador porque o povo, virgem maria! Sai da janela se quer sonhar vem pra cama vem pra ca pra voce ver o que é bom pra voce montes au ginkgo plein de rameaux viens dõici soup'onner des oiseaux qui ne volent pas viens tu voler je voyage partout"
Anjo de Vitrô,/djavan/anjo-de-vitro.html,Rua dos Amores,"Noutro lugar amanheceu A várzea florescida ressurgiu... Pensei sob o excelso mundo: E eu?... Céu singular Bruma a pender, Da margem escura luz a devenir Será seu rosto imaculado A refulgir? Pra abalar com essa graça toda Num dia feito pra surpreender, Avisto o vento rasgar sedento De Norte a Sul! Mas era só a chuva que caía Com suas setas transpassando o dia Tecendo a noite azul!  Dada como um anjo de vitrô, Pura flor sem pecado Você tímida e assustada E eu aqui... deslumbrado Mas num dia delirante Escalou-me em voo irado, Dando pinta, tipo pronta ? Embarquei...  Céu singular Bruma a pender, Da margem escura luz a devenir Será seu rosto imaculado A refulgir? Pra abalar com essa graça toda Num dia feito pra surpreender, Avisto o vento rasgar sedento De Norte a Sul! Mas era só a chuva que caía Com suas setas transpassando o dia Tecendo a noite azul!  Dada como um anjo de vitrô, Pura flor sem pecado Você tímida e assustada E eu aqui... deslumbrado Mas num dia delirante Escalou-me em voo irado, Dando pinta, tipo pronta ? Embarquei encantado Com um anjo de vitrô...  Dada como um anjo de vitrô, Pura flor sem pecado Você tímida e assustada E eu aqui... deslumbrado Mas num dia delirante Escalou-me em voo irado, Dando pinta, tipo pronta ? Embarquei encantado!"
Ânsia de Viver,/djavan/ansia-de-viver.html,vidas pra contar,"Se pretender me dominar Sou escravo Visando a nada lhe faltar Me endivido E nessa ânsia de viver Eu me mato Pra me aquecer Com o seu calor Se quer saber por que você Logo direi É um bater descompassado Que me vem Nem é preciso Deus dizer O certo sou eu Pra conviver Com os lábios seus E na luz que existe Para o dia iluminar Vê-se um par romântico Se beijar se olhando No fundo azul É zoom, é zen Você e eu E mais ninguém Já que o amor soberano Pode enxergar no escuro Vou estar sempre esperando Você me aclamar O seu porto seguro"
Ao Menos Um Porto,/djavan/ao-menos-um-porto.html,D,"Eu que sou de declamar O seu nome nas ruas Volta pra mim Pra não me destruir Ruim que pode piorar É assim que eu me sinto Não, não se vá Venha cá Vem pra mim Canteiros onde não sei Irei encontrá-los Nas nuvens De quando eu lhe abraço E tudo é tão bom Nada é tão bom Amor que tanto guardei Pra lhe dedicar Sem medir, sem pensar Sem amar não dá pra viver Nem pra morrer Ninguém pode mensurar Quando bate é uma coisa Pra nunca mais Não se vá Vem pra mim Barco a derivar Sem lugar pra ir Sem um mar Nada que vá me garantir Ao menos um porto Na escuridão Que vai ser Caso me diga: não  Ninguém pode mensurar Quando bate é uma coisa Pra nunca mais Não se vá Vem pra mim Canteiros onde não sei Irei encontrá-los Nas nuvens De quando eu lhe abraço E tudo é tão bom Nada é tão bom Amor que tanto guardei Pra lhe dedicar Sem medir, sem pensar Sem amar não dá pra viver Nem pra morrer Eu que sou de declamar O seu nome nas ruas Não, não se vá Venha cá Vem pra mim"
Apoteose Ao Samba,/djavan/apoteose-ao-samba.html,Ária,"Samba, Quando vens aos meus ouvidos, Embriagas meus sentidos, Trazes inspiração, A dolência que possuis na estrutura, É uma sedução, Vai alegrar o coração daquela criatura, Que com certeza está sofrendo de paixão.  Samba, Soprado por muitos ares Atravessaste os sete mares, Com evolução, O teu ritmo que te torna ainda mais ardente, Quando vem da alma de nossa gente.  Eu quero que sejas sempre meu amigo leal, Não me abandones não, Vejo em ti o lenitivo ideal, Em todos os momentos de aflição, És meu companheiro inseparável de tradição, Devo-lhe toda gratidão, Samba, eu confesso, És a minha alegria, Eu canto para esquecer a nostalgia."
Aquele Um,/djavan/aquele-um.html,Para Sempre: Djavan,"Baixou Num centro de mesa de um bar Um santo estranho Cheirou, fumou, não cuspiu, Sei lá..... E tocou piano Falou que ""era aquele um"" Das quebradas O santo de cama Das mal amadas Alguém do centro perguntou o seu ponto Aí o santo lhe respondeu: Meu ponto é qualquer um Com bicheiro e taxi  Zarakiê, Zaraquiê, Zoroquiê Zaraquiê, Zoroquiê Zô  © copyright 1980 Tapajós/EMI"
Ares Sutis,/djavan/ares-sutis.html,Rua dos Amores,"Quanto mais eu sei Menos eu sei quem sou. Será que eu vivi Tudo porque passei... E quem será que eu sou? Mesmo podendo imaginar O que eu quiser, Eu não sei se sou tanto!  Quanto mais eu sou Menos sou o que sei. E pra o que nasci, Será que cumprirei? O que será que eu sei Num corpo a mendigar, Qual é a lei No desvão do amar?  Me consumi Pra ter um pouco de ti, Clamei por atenção! Jamais usei Sapatos tão peculiares, Andei vestida por colares mis, Violentei até meus ares sutis!...  E o que não tem fim Começa outra vez: Quanto mais eu sou Acho que mais eu sei O que vai ser, enfim - Sedada de afeição - Eu vou viver Pra esquecer de mim.  Quanto mais eu sou Menos sou o que sei. E pra o que nasci, Será que cumprirei? O que será que eu sei Num corpo a mendigar, Qual é a lei No desvão do amar?  Me consumi Pra ter um pouco de ti, Clamei por atenção! Jamais usei Sapatos tão peculiares, Andei vestida por colares mis, Violentei até meus ares sutis!..."
Aridez,/djavan/aridez.html,vidas pra contar,"Atravesso o deserto escuro Pra fugir da solidão Você que é meu farol Não deixe eu me perder, não É você quem há de me tirar Dessa tremenda aridez Você que me faz sonhar Veja o que faz dessa vez Sonhador, devagar ou voando Chego lá! De sonhar, eu sei Que já nem vivo mais E mesmo amando só A esperança não se desfaz O amor chega a ser um pecado De tão bom É a paz forjada Por conflitos mil Abalos pontuais Quando se ama, vive-se mais Quantos beijos Poderíamos ter dado E os encantados dias Que como tudo indica Seriam Não faz mal Você é água da fonte Que irriga um coração Feito pra bater Pra sempre por você Amor!"
Asa,/djavan/asa.html,"Djavan na Pista, Etc","A manhã me socorreu com flores e aves Suaves, soltas, em asa azul Borboletas em bando Diz que pedra não fala Que dirá se falasse Eu: ""Ama? Me ama, Me queima na sua cama"", O veludo da fala Disse: ""Beijo, que é doce Me prende, me iguala Me rende com sua bala"". Diz que pedra não fala Que dirá se falasse Eu: ""Ama? Me ama Me queima na sua cama"". O veludo da fala Disse: ""Beijo, que é doce Me prende, me iguala Me rende com sua bala"" Se disfarce de Zeus De Juruna, na deusa Azul Se me comover Eu já sei que és tu Claridade de um novo dia Não havia sem você Você passou e eu me esqueci O que ia dizer  (Refrão) O que há pra falar? Onde leva essa ladeira? Que tristes terras vencerá Um intérprete tocando Blues?"
Atitude,/djavan/atitude.html,Bicho Solto - O XIII,"Por você de tudo farei Te quero demais Você sabe Tudo, tudo é atitude Até o mar que é a vida do pescador Esse mar eu te dou Diga o que é que eu sou pra você Se sou pouco ou nada Não me diga nada Magoar pra quê? Até porque eu Não saberei viver sem você Longe de ti, dias sem céu A refletir nos olhos meus Casas sem cor, nenhum lugar Que eu queira ir ou passar Se você não está ali Pra me abalar Com sua doce visão As mãos frias de amor Aquecendo as minhas mãos Dona da luz Que invade o meu coração."
