Nome da Música,link,album,letra
Por Uma Vida Em Paz,/djavan/por-uma-vida-em-paz.html,Matizes,"Não sei bem o que dizer Sobre o mal na Terra: Acho que amor hesitou! A devastação da mata Traz morte e medo As guerras: caos e miséria O incontrolável degelo Não vai trazer Futuro algum Não vai. O homem quer sempre mais! Mas se não faz o pão O que vai ser Dos filhos Não é dizendo não Que vão crescer Os lírios Saber doar Renunciar, dividir Devia vir de qualquer um Viver já Vamos usar essa lei Depois de tanto dano O que não falta É aviso Pra que não haja engano Posso ser mais Conciso Por uma vida em paz Tudo o que for Preciso! Juízo.   (fonte: site oficial)"
Presunçosa,/djavan/presuncosa.html,,"Malcriada Maltratou meu coração Uma topada de amor por vingança Deixa um desfecho ruim como herança  Presunçosa Me comove, me destrói Uma topada de amor por vingança Deixa um desfecho ruim como herança  Paciência se tudo terminou Meu orgulho caiu, mas levantou Paciência se tudo terminou Meu orgulho caiu, mas levantou  Malcriada Maltratou meu coração Uma topada de amor por vingança Deixa um desfecho ruim como herança  Paciência se tudo terminou Meu orgulho caiu, mas levantou Paciência se tudo terminou Meu orgulho caiu, mas levantou  Presunçosa Me comove, me destrói Uma topada de amor por vingança Deixa um desfecho ruim como herança  Paciência se tudo terminou Meu orgulho caiu, mas levantou Paciência se tudo terminou Meu orgulho caiu, mas levantou  Paciência se tudo terminou Meu orgulho caiu, mas levantou Paciência se tudo terminou..."
Primazia,/djavan/primazia.html,vidas pra contar,"Fique assim, assim Dê continuidade à mulher Que me faz tão bem como é Que vem no meio da noite Procurar o que quer Seja assim, assim Sempre uma pessoa do bem Que amar é tudo o que tem Porque maior doçura Não existe em ninguém Sou estável Mas, sem ti não sei quem sou Me enamorei e é pra casar Primazia De quem tem um grande amor É escolher Viver como for! És o mar em mim Vago em tuas sendas azuis Só para perder-me em ti É embriagador Quando me conduzes Tudo fosse assim Ninguém saberia sofrer Nem se poderia supor Um mar de ilusão Onde se debater Sou estável Mas, sem ti, não sei quem sou Me enamorei e é pra casar Primazia De quem tem um grande amor É escolher Viver como for"
Primeira Estrada,/djavan/primeira-estrada.html,D,"Esse seu coração Nunca foi tão frio Da pra ver a ilusão Na beira do rio Rio Imploro pra você ficar Quem disse que fica? Não fica! Com tanto pra lhe dar E você modifica Fica Campos que florirão Num sertão de vinho Você se vai sem razão E leva o caminho De vez Como é que vai ser Pra viver Precisando tanto De você Se alguém sabe de amor Por favor, me fale Se era amor, por que acabou? Quem amou não sabe Não se sabe Só um pouco de atenção Encheria-me de brios No mar do meu coração Trago os meus navios Ávidos Pra resistir e proteger De todo o perigo Digo Ficar sem você, já vou dizer Não consigo! Sigo Sonhei com um grande amor E o que tive foi nada O que era doce acabou Na primeira estrada Nada Como é que vai ser Pra viver Precisando tanto De você? Se alguém sabe de amor Por favor me fale Se era amor por que acabou? Quem amou nunca sabe Não se sabe"
Qual É?,/djavan/qual-e.html,,Mas qual é De Que lado estás Vou pra frente Tu vais pra trás  Mas qual é Diga de uma vez Eu te espero Já faz um mês  Meu Deus ai ai Ai que loucura Você joga só contra mim Só contra mim  Você rema contra a maré De repente a maré não dá pé Não dá mais pé Mas qual é
Quantas Voltas Dá Meu Mundo,/djavan/quantas-voltas-da-meu-mundo.html,A Voz e o Violão,Rede de malha jangada de vela içada no ar Quem não se arrisca não joga a isca Atividade no mar Quantas voltas dá meu mundo Sei lá  Pasto na relva madeira de selva coberta de flor Seja silvestre preste ou não preste Atrai de longe o amor Quantas voltas dá meu mundo Sei lá  Chega domingo ninguém na igreja não tem oração Tudo que é santo vive de encanto Acorde a fé irmão Quantas voltas dá meu mundo Sei lá  Noite de lua viola na rua pra vida esquecer Canto aberto verso incerto A noite o amanhecer Quantas voltas dá meu mundo Sei lá  Jeito brejeiro retrato inteiro da população Vida sem rumo mas em resumo Amor no coração Quantas voltas dá meu mundo Sei lá   © 1976 BMG Music Publishing Brasil
Quase de Manhã,/djavan/quase-de-manha.html,Meu Lado,"Se você quer me namorar Enfrento mar, Correria e trânsito No sufoco grito rá Um saravá E se não der Viro satã Dou a mão à política Cética Crítica Ou pratico o ramadã Mas se você disser que não Não largo mão Desse jeito lânguido Fico chato pra comer A rua vem me ver Não quero Vou deixar a saudade lamber O que ia ser mel E sal virou Meu bem Sem você pra que o mar Mesmo as estrelas Hão de brilhar Tão cheias de dúvidas Na luz dos olhos meus O que era pra bater Bateu Coração não dorme E é quase de manhã.  © 1986 Luanda Edições Musicais Ltda."
Quase Fantasia,/djavan/quase-fantasia.html,D,Cada vez que eu te enlaço É bom Mas se eu te desfaço É melhor É pura viagem Poderei conquistar a lua Se eu tocar nessa boca tua Nessa paisagem Vaidade é necessária Mas escorrega Quem não a domina bem Desequilibra e cai Fui na trama dos teus passos Sucumbir Quase como se eu fosse um doente E você o elixir Cada vez que eu te enlaço É bom Mas se eu te desfaço É melhor Quase fantasia Se você não tem o poder De recusar ou escolher O que mais teria?
Quase Perdida,/djavan/quase-perdida.html,Rua dos Amores,"Não pude crer: Cê me ligou, Quando eu já estava conformado! Não vou mais entender você Não quero mais lhe censurar. Se for pra ter Sem pagar a mais, Deixa estar: Isso já dá. Seja em madri ou no algarve Pra onde for, Estarei do lado, Viverei declamando: Discórdia, nunca mais Agora é só Amor e paz. Ninguém duvida Que será tão bom Do seu batom, sobreviver E cair nos seus braços Todo dia Como os cristais No amanhecer. Quase perdida, Numa noite em flor, Você, de amor, Me mataria Sendo assim, Não será demais Se eu disser que a amarei Por todas as vidas Não puder crer Cê me ligou, Quando eu já estava conformado! Não vou mais entender você Não quero mais lhe censurar. Se for pra ter Sem pagar a mais, Deixa estar: Isso já dá. Seja em madri ou murici Pra onde for, Estarei do lado, Viverei declamando: Discórdia, nunca mais Agora é só Amor e paz."
Que Foi My Love?,/djavan/que-foi-my-love.html,Malásia,"Que foi my love? Quando você fica assim Eu não sei, Se a love story que nos envolveu Ainda bate uma bola Ou o gato comeu. Me olha e diz se ainda está a fim Vai logo, e taca um beijo em mim (claro!...)  Que foi my love? Quando dei por mim O clima já estava estabelecido Acabou de passar batom vermelho E pelo espelho Me lançou um olhar sofrido. Quer conversar, faz mais sentido Quem sofre de véspera é peru.  Lembra-se da primeira vez, Eu viajei nos rosas do seu corpo nú Depois a gente se refez E jamais você me pareceu tão bem Estavas tão bem...  Que foi my love? Nada pode justificar medos e dúvidas Te quero agora como jamais Poderei querer mais ninguém (eu acho né?...) Mas, se não for exatamente isso Relaxa e aproveita o que tem!   © 1996 Luanda Edições Musicais Ltda."
Quero-Quero,/djavan/quero-quero.html,Novena,"Quem não tomou banho de bacia não é sabedor que a água bem quente logo esfria não vá-se embora não você vive igual `as andorinhas se mudando, se mudando vê lá se não quer pousar na minha para parar de fugir, parar de fugir para que fugir tanto... Você me domina desde o dia que o bumba passou com graça pegou tudo o que tinha e deu para o boi lamber vestida de flores, pedraria visual umbanda esfregou nas fuças da vizinha todo esse seu jeito de ser passei na novena da igrejinha pedi pro meu amor depois carne sêca com farinha na casa de zé nestor um dedo de prosa e Zé me pôs a par que júlia nasceu coitada da mãe é tão novinha e dizem que o pai ali sou eu que graça sem graça, credo! Tem graça, disfarça e sai prá lá entrei pela porta da folia e vi um corredor que leva `a torre da alegria onde vive seu amor de lá com asas de andorinha sai voando, sai voando vê lá se não quer pousar na minha para parar de fugir, parar de fugir para que fugir tanto... Vejo o quero-quero cantarolar ali por nós dois e toda janela se abrirá pensando em você e a saudade pinta o céu de encarnado com a água da lavagem do vermelho e o dia desperta mal-encarado em ver toda ajuda desperdiçada não vá-se embora não que fique em nome da lei prá sempre onde eu te alcance se você sai voando que graça sem graça, credo! Tem graça, disfarça e sai prá lá  © 1994 Luanda Edições Musicais Ltda."
Quinze Anos,/djavan/quinze-anos.html,Rua dos Amores,"Quinze anos: Só pra quem faz De tudo um plano Para defender as divisas Do próprio reino. Quinze eras: Base de cada primavera De duas vidas enredadas De bem querer! Quis esse mar Dos seus olhos descer Pra me arrastar Pelos cantos Admirado em seus encantos Com a alma frondosa de vida, Perdidamente! Oh! flor de cristal que brotou Em meio ao lírio Pra vida inteira Seguir sua voz, Acolher-me aos pés E adorar quem sou... Bendizer aos céus Por querido ser E viver de amor! O que estabeleceu Você e eu Não se dilui, Mas eu posso dizer: Eu e você, Rio que flui!"
Real,/djavan/real.html,Não É Azul Mas É Mar,"Vou sair por aí prá pensar em você e fazer o que só deus sabe distrair meu olhar me deixar conduzir dar de cara com o mar e voce lá a luzir vejo voce como a um lugar bom de se ver livre pra correr e brincar feito um jardim tão natural que você pra virar flor só precisa dos meus olhos te abracei, me perdi não vi mais nada ali fui bater onde havia música e na paz do prazer eu gozei quanto quis de sonhgar com voce posso dizer que sou feliz penso em você na ilusão de te encontrar louca por me procurar sî no amor tudo é real e você é uma flor a me prometer o céu  © 1987 Luanda Edições Musicais Ltda."
Rei do Mar,/djavan/rei-do-mar.html,Djavan - Novelas,"Vou me perder No azul verde do mar Junto da manhã Em busca da vida  Vou remover Lendas, tormentas, paixão Livre a navegar Em busca da vida  Que me importa A brisa fria O brilho dos faróis Que me importa O fundo, a calmaria e o temporal  Eu sou o rei Eu sou o rei Eu sou o rei do mar Da minha cidade natal   © 1975 BMG Music Publishing Brasil"
Renunciação,/djavan/renunciacao.html,Novena,"Tantos anos devotados, renunciação nada tocaria seu coração se revelou desgarrado e plano como vidro frio e sem cor ao declarar tolo o meu querer achei que a vida fosse sob medida com voce um bem da natureza mas, não. E na ilusão de que me querias, como eu quanto amor se perdeu meu Deus! Novos planos, vida nova , alma de ateu preso na parede o meu coração seu pra onde vou, o que mais farei, de quem eu sou, o que serei?   © 1994 Luanda Edições Musicais Ltda."
Retrato da Vida,/djavan/retrato-da-vida.html,Bicho Solto - O XIII,"Esse matagal sem fim Essa estrada, esse rio seco Essa dor que mora em mim Não descansa e nem dorme cedo O retrato da minha vida É amar em segredo Não quer saber de mim E eu vivendo da tua vida Deus no céu e você aqui A esperança é quem me abriga Esses campos não tardam em florir Já se espera uma boa colheita E tudo parece seguir Fazendo a vida tão direita Mas e você o que faz Que não repara no chão Por onde tem que passar E pisa em meu coração? O teu beijo em meu destino Era tudo o que eu queria Ser teu homem, teu menino O ser amado de todo dia.   © 1998 Luanda Edições Musicais Ltda. Dominguinhos"
Reverberou,/djavan/reverberou.html,Rua dos Amores,"Com medo eu chamei pra dançar, Não sei nem se você me ouviu Meu coração pra pular, Cê em vez de falar, sorriu...  Tomei aquilo como um sim Meu corpo até reverberou! Vejo você levantar, Penso: Vou abraçar O AMOR.  Não sei se é assim Que o amor nasce, Mas sei que perambular Por beijos sem desejo Não é luz – é o breu E por ser ela a luz que me renasce, No instante em que eu a enlaçar, Socorro! Posso pirar Com o calor do corpo dela. Meu Deus!  Com medo eu chamei pra dançar, Não sei nem se você me ouviu Meu coração pra pular, Cê em vez de falar, sorriu...  Tomei aquilo como um sim Meu corpo até reverberou! Vejo você levantar, Penso: Vou abraçar O AMOR.  Não sei se é assim Que o amor nasce, Mas sei que perambular Por beijos sem desejo Não é luz – é o breu E por ser ela a luz que me renasce, No instante em que eu a enlaçar, Socorro! Posso pirar Com o calor do corpo dela. Meu Deus!  Não sei se é assim Que o amor nasce, Mas sei que perambular Por beijos sem desejo Não é luz – é o breu E por ser ela a luz que me renasce, No instante em que eu a enlaçar, Socorro! Posso pirar Com o calor do corpo dela. Meu Deus!"
Ridículo,/djavan/ridiculo.html,D,Não há o que fazer Eu nasci Com tudo pra seguir Comigo aprisionada a você A mesma raiz De uma vida A dois Capaz de até morrer Por amor Eu não via nada Mais sublime Só em seu abraço Eu me encontrava Ridículo! E fui descobrindo Em cada gesto A sanha De quem nunca prestou E chorei até ruir Como é que eu pude Ter a quem Nunca me quis? E me enamorei Fui feliz Me casei Com alguém Que nunca Existiu
Romance,/djavan/romance.html,Meu Lado,"Fruta-de-conde, Sua casca é um romance Muito boinha você, Viu? Laranjinha doce Dulcíssima... Pitomba jura Amargura no caroço Goiaba quase de vez Mamoeiro dá um leite: Que fel Pitanga do céu Amor de maçã Debaixo do frio Por dentro do mato, Fruto do ato Ligado do ato Ligado à resina de cajá Manga-espada inchada Eu sou do mato Brinquei com maturi, Vou ficando por aqui Nas costas da madrugada Por dentro do mato Fruto do ato Ligado à resina de cajá Manga-espada inchada Eu sou do mato Brinquei com maturi Vou ficando por aqui Meu bem me abraça E a lua quer me dizer Te amo.  © 1986 Luanda Edições Musicais Ltda."
Romeiros,/djavan/romeiros.html,,"Capoeira galho seco Barro duro pé no chão Espinho poeira e estrada Burro boi de carroção Tudo isso tá lá No meu sertão Tudo isso tá lá No meu sertão  Eu cansei os olhos de ver O mato pari Erva sidreira, erva daninha M‹e boa ter de alecrim Carrapateira na beira da pista Capim santo canção  Essa lembrança me marea a vista E rasga meu coração (bis)  Capoeira galho seco Barro duro pé no chão Espinho poeira estrada Burro boi de carroção Tudo isso tá lá No meu sertão Tudo isso tá lá No meu sertão  A forma do cactos da Que nem se avalia Samba cai cai Banho romeiro Que é noite de romaria Religiosamente Se roga se reza canta-se  Levanta fiéis Com muita alegria Vim beijar Jesus Que é filho de Maria   © 1978 Warner / Chappell"
Rua Dos Amores,/djavan/rua-dos-amores.html,Rua dos Amores,"Vê! O horizonte despe a lua, A rua se amontoa pra ver E a nua nem tá aí Pra o que faz...  Ver! Você assim, descendo a rua... A lua logo passa a saber Quem é tudo, Quando encontra... VOCÊ!"
Sabe Você?,/djavan/sabe-voce.html,,"Você é muito mais que eu sou Está bem mais rico do que eu estou Mas o que eu sei você não sabe E antes que o seu poder acabe Eu vou mostrar como e por que Eu sei, eu sei mais que você Sabe você o que é o amor? Não sabe, eu sei Sabe o que é um trovador? Não sabe, eu sei. Sabe andar de madrugada tendo a amada pela mão Sabe gostar, qual sabe nada, sabe, não Você sabe o que é uma flor? Não sabe, eu sei. Você já chorou de dor? Pois eu chorei. Já chorei de mal de amor, já chorei de compaixão Quanto à você meu camarada, qual o que, não sabe não E é por isso que eu lhe digo e com razão Que mais vale ser mendigo que ladrão Sei que um dia há de chegar e isso seja quando for Em que você pra mendigar, só mesmo o amor Você pode ser ladrão quando quiser Mas não rouba o coração de uma mulher Você não tem alegria, nunca fez uma canção Por isso a minha poesia, ah, ah, você não rouba não Ah, ah, você não rouba não"
Sabes Mentir,/djavan/sabes-mentir.html,Ária,Sabes mentir Hoje eu sei que tu sabes sentir Um falso amor Abrigaste em meu coração Sempre a iludir Tu falavas com tanto ardor Dessa paixão Que dizias sentir Mas tudo agora acabou Para mim terminou a ilusão Hoje esse amor já findou E afinal para que amar Sempre a iludir Tu beijavas com afeição Sempre a fingir Uma falsa emoção Sabes mentir Hoje eu sei que tu sabes sentir Um falso amor Abrigaste em meu coração Sempre a iludir Tu falavas com tanto ardor Dessa paixão Que dizias sentir Mas tudo agora acabou Para mim terminou a ilusão Hoje esse amor já findou E afinal para que amar Sempre a iludir Tu beijavas com afeição Sempre a fingir Uma falsa emoção
Sabor Impune,/djavan/sabor-impune.html,,Entre a planta do meu pé e o cume da sua cabeça acontece o que deus não quer mas resiste a bessa quem falou que uma ponte une suponho quis ser preciso mas usou do sabor impune de tanto riso pelo pé que rama o chão e o lume da sua estrela descanse a cabeça na mão e vá dizer a ela que além dos que estão envolvidos na flor da dura semente eu juro pela alma dos bandidos que o resto é gente    © 1979 Edições Musicais Tapajós Ltda. (EMI)
Samba Dobrado,/djavan/samba-dobrado.html,,Vai ser pior ainda Quando amanhecer Tudo que se tem pra cantar Não dá pra embalar Nem pra devol...ver O direito de escolher  A música melhor para se dan...çar A música melhor para se dan...çar  Quem faz parte dessa cena Gravando! Pode rodar Pra cumprir a mesma pena Não é preciso ensaiar Tá combinado  Basta aprender Samba dobrado Basta aprender Samba dobrado Basta aprender Samba dobrado
Samurai,/djavan/samurai.html,Ao Vivo - Vols. 1 e 2,"Ai.... Quanto querer Cabe em meu coração Ai.... Me faz sofrer Faz que me mata E se não mata, fere Vai.... Sem me dizer Na casa da paixão Sai.... Quando bem quer Traz uma praga E me afaga a pele  Crescei, luar Pra iluminar as trevas Fundas da paixão Eu quis lutar Contra o poder do amor Caí nos pés do vencedor Para ser o serviçal De um samurai Mas eu tô tão feliz! Dizem que o amor Atrai...   © 1982 Luanda Edições Musicais Ltda."
Se Acontecer,/djavan/se-acontecer.html,Vaidade,"As estrelas brilham sem saber mas cada vez melhor pois foi só você aparecer todas desceram pra ver você brilhar de cor o que mais chamou minha atenção sua expressão sutil isso eu já não posso esquecer porque não foi só visão o coração sentiu a tenda da noite enche de sombra um sonhar vazio percorri tantas fontes até ver você sair do nada pros meus horizontes que a manhã pura e sã com as mãos de jasmim vá roçar seu rosto pro amor ardente despertar por mim Deus é pai, vai saber se acontecer serei seu até o fim e em tempo de chuva que chova eu não largo da sua mão nem que caia um raio eu saio sem você na imaginação   © Ed. Luanda LRO-0400001"
Se Não Vira Jazz,/djavan/se-nao-vira-jazz.html,vidas pra contar,"Pra conversar, brigar, beijar Eu to pronto pra tudo Não quero nada Sem solução Viver é mais que bom demais Quando o amor Tá incluso É um abuso De perfeição Eu te quero sã Como uma flor No ardor do calor da manhã Pra que lamentar O que a gente não fez? Passou Agora é outra vez Pra se ligar, pra discutir Como reconstruir nossa paz E o ideal de um lar Brilhar de novo Se não vira jazz Pra conversar, brigar, beijar Eu to pronto pra tudo Não quero nada Sem solução Viver é mais que bom demais Quando o amor Tá incluso É um abuso De perfeição A noite a passear pela bruma Verá em cada colina O quanto eu te amo Depois, a madrugada invade Um sonho em que tu me tinhas Amor de verdade!"
Se...,/djavan/se.html,"Djavan na Pista, Etc","Você disse que não sabe se não Mas também não tem certeza que sim Quer saber? Quando é assim Deixa vir do coração Você sabe que eu só penso em você Você diz só que vive pensando em mim Pode ser Se é assim Você tem que largar a mão do não Soltar essa louca, arder de paixão Não há como doer pra decidir Só dizer sim ou não Mas você adora um se...  Eu levo a sério mas você disfarça Você me diz à beça e eu nessa de horror E me remete ao frio que vem lá do sul Insiste em zero a zero e eu quero um a um Sei lá o que te dá, não quer meu calor São Jorge por favor me empresta o dragão Mais fácil aprender japonês em braile Do que você decidir se dá ou não.   © 1992 Luanda Edições Musicais Ltda."
Seca,/djavan/seca.html,Malásia,"A terra se quebrando toda  A fome que humilha a todos  Vida se alimenta de dor  Que pobre povo sem socorro  Por que será que Deus pôs ali  O ser pra ser assim sofredor  Sob a brasa do sol padecer  O desdém do poder fingido  Sem saber o que é ser feliz  Viver, como se diz, dá medo  Apesar de se ter céu azul  O mesmo lá do sul, mesmo Deus"
Seduzir,/djavan/seduzir.html,Para Sempre: Djavan,"Cantar é mover o dom do fundo de uma paixão Seduzir As pedras, catedrais, coração Amar é perder o tom nas comas da ilusão Revelar todo sentido Vou andar, vou voar pra ver o mundo Nem que eu bebesse o mar encheria o que eu tenho de fundo Vou andar, vou voar pra ver o mundo Nem que eu bebesse o mar encheria o que eu tenho de fundo Vou andar, vou voar pra ver o mundo Nem que eu bebesse o mar encheria o que eu tenho de fundo"
Segredo,/djavan/segredo.html,Meu Lado,"Intro: (Gm7 C9/7) Gm7 C9/7 Desses olhos Gm7 C9/7 Tenho medo Gm7 C9/7 Quer dizer tudo F7 Bb7 Tudo é segredo Gm7 C9/7 Vejo em sua cor Gm7 C9/7 que tudo será triste Gm7 C9/7 Gm7 C9/7 Se um dia eu deixar de te ver Gm7 C9/7 O teu beijo Gm7 C9/7 Eu invento Gm7 C9/7 Na sala escura F7 Bb7 Do sentimento Gm7 C9/7 Quando bate a dor Gm7 C9/7 Eu sei que o amor existe Gm7 C9/7 E onde vive que eu chamo Gm7 C9/7 F7 E não vem Eb9/7+ Sofrer, cantar Gm7 Socorrer, fugir da paixão pra que? Eb9/7+ Mesmo onde há certeza de dores Gm7 Que flores dão Eb9/7+ Que nem de algodão Gm7 Vago em teu calor C9/7 Sou, sou tão leve F7 Se o amor é breve F#o Deixa nascer ( Gm7 C9/7 ) Pra ver...  "
Sem Saber,/djavan/sem-saber.html,,"A vida já é um absurdo, com você longe, muito mais a estrada é ruim oh! Trânsito que não vai mas com a gente tudo ia em paz é você que esquenta sem saber você não me vê como eu sou quando vou te ver dias sem calor que fará o que me dirá? Fui prá cama cedo temendo o mistério que desassossego me diz o que quer e eu dou e não dou esperando nada dou... Silêncio da noite , a noite brilhando meu bem eu te adoro eu sigo pensando: vou! Ou não vou? Eu preciso dela, vou. Enfrentar o caos conceder, reconstruir retirar o sal vamos ver, se ela sorrir sorrirei também e farei, seja o que for pra voltar atrás e o que mais, mais vale o amor.   © 1994 Luanda Edições Musicais Ltda."
Sentimento Verdadeiro,/djavan/sentimento-verdadeiro.html,Vaidade,Pode ser quem for Nasceu pra ter amor Só não sabe quando ele virá  Se é cerca de flor Ou jogo de azar Só quem tem amor sabe contar  Um sentimento verdadeiro Passa a céu e chão Faz do tormento passageiro Do coração Vive por si Sempre aprendendo a existir  Quase não pensa no que faz Quando é pra se dar Tão querido quanto nada mais É o que há  Sem se conter Ou é tudo ou não dá pra ser Vaga entre o lírio da luz solar E a agonia do quebra mar Forjado em um tesouro Que não existe pra se encontrar Como um amigo estende a mão Tingida de solidão
Serrado,/djavan/serrado.html,Para Sempre: Djavan,"Se o Senhor me for louvado Eu vou voltar pro meu serrado Por ali ficou quem temperou O meu amor e semeou em mim Essa incrível saudade Se é por vontade de Deus Valei, valei  Se pedir a Deus pelo meu prazer Não for pecado, vou rezar Pra quando eu voltar a rever Todas as brincadeiras do passado Cortejar meu serrado Em dia, feriado Viva o cordão azul e encarnado  Eu sei, serei feliz de novo Meu povo, deixa eu chorar com você Serei feliz de novo Meu povo, deixa eu chorar com você Serei feliz de novo Meu povo, deixa eu chorar"
Sevilhando,/djavan/sevilhando.html,D,Andaluz é o mar E o negro nosso trigo Cantam pra confirmar Amor em cada abrigo Onde os dois proclamam Que só quem ama Não teme o perigo E não querem nada Além de a todos Com o canto encantar Mas Sevilha plantou Na Alagoas nata Um fiel servidor A par do que se trata E uma música negra Vai sevilhando Tudo ali na lata E só é inteiro O que aclama Toda forma de amor Ao se falar de vida Vê-se o quanto é tão sério Nada mais é a vida Que sede de um grande império Deus é quem dá o caminho Mas as pernas são as suas Trate de vencer A tudo quanto for subida Decida Uma é saber como A outra é nada saber Queria sândalo Mas também podia ser camomila Ou mesmo lavanda Ou vanila Para enfrentar o viver
Sílaba,/djavan/silaba.html,Milagreiro,"Quem me dirá, não o que desejo nem o que sei, mas aquilo de que preciso sem botar nem tira uma sílaba? quem saberá contar o enredo sem alterar o tom, o teor e o desfecho sem errar nem mudar uma vírgula? toda amizade tem seus deslizes da empolgação à desilusão é o afã que a gente tem sabendo onde vai dar num cenário idealizado. bem que o desejo fala mais claro diz logo a que vem sem enrolação mas se alguém insiste em ficar boiando na dor ora, faça-me o favor!   © 1992 Luanda Edições Musicais Ltda. Spell (Amar)"
Sim ou Não,/djavan/sim-ou-nao.html,Alumbramento,Um dia preciso ir Na casa da solidão Só pra saber Se o que sofri Dá pra beber Outra paixão  Em mim O amor se fez Do jeito Que se inventou Toda razão Perde o seu fim Se um coração For o juiz Vai redimir O medo de amar  Saudade Enquanto O amor ferir E o pranto A dor sarar Não digo não Nem dou o sim Deixo O meu coração Chorar por mim
