Nome da Música,link,album,letra
Milagreiro (part. Cássia Eller),/djavan/milagreiro.html,Milagreiro,"Agora vamos ter os girassóis do fim do ano e o calor vem desumano tudo irá se expandir crescer com as águas quiçá, amores nos corações e um santeiro, milagreiro prevê a dor de terceiros e diz que a vida é feita de ilusão e um santeiro, milagreiro prevê a dor de terceiros e diz que a vida é feita de ilusão aquela que um dia o fez sonhar se foi com o outro no dia em que os dois se casariam por amor ele aluou hoje o seu pesar cintila nos varais usou as sete vidas e não foi feliz jamais toda a imensidão passou pela vida e foi cair na solidão mais um santo para esculpir é o que lhe vale pra evitar que o rancor suas ervas espalhe"
Minha Irmã,/djavan/minha-irma.html,Luz,Vento cantou na mata trovão roncou filho de juca que raio matou mãe disse que eu botasse olho em você então passa pra dentro menino vai chover...   © 1982 Luanda Edições Musicais Ltda.
Minha Mãe,/djavan/minha-mae.html,,"O descampado se via E eu de esperar Tava morta Com jeito de agonia Eu me encostava na porta  A disfarçar a barriga Dos risos da fantasia Fingindo ter Nos meus olhos Um sol que nunca podia  Via passar procissões E os velhos nos caramanchões ê, ê Via passar esses dias Como se fossem dobrados Ardia em mim Esse filho Como se fosse pecado Filho do pecado  © 1978 Warner / Chappell"
Miragem,/djavan/miragem.html,"Djavan na Pista, Etc",Com a mão de um desejo Selvagem Roubarei a seda Que o beijo guardou Só pra dar uma riqueza Pro meu amor Vivo por que te vejo Miragem Num lampejo de abelha Fazendo o mel Vou fazer no céu Do teu carinho  Uma lã pro cio Na certeza De quem faz o vinho Teu calor Alucina E a pleno rigor Domina Feito uma coisa Que mata de prazer Deixa ver Se eu não morrer Te quero de novo Ando por onde vejo Miragem Um beijo passou por mim.
Morena de Endoidecer,/djavan/morena-de-endoidecer.html,Para Sempre: Djavan,"Saí na porta de casa olhei pro céu e pensei: parece que vai chover parece que vai chover parece que vai chover o amor que trago no peito é carga pra mais de dez morena de endoidecer morena de endoidecer morena de endoidecer morena de endoidecer vai pensamento, vai viajar de navio pra ver que fim levou minha vida quando você foi embora o céu deu de escurecer será que eu fiquei chorando, ô ô parece que vai chover será que fiquei chorando, ô ô parece que vai chover será que eu fiquei chorando, ô ô parece que vai chover  © 1981 Edições Musicais Tapajós Ltda. (EMI) Musiclave Editora Musical Ltda."
Muito Mais,/djavan/muito-mais.html,Meu Lado,MUITO MAIS Djavan  Quero saber Amor Se me quer em seu coração Eu prefiro morrer Acabou Só não quero levar um não Quero saber Amor Se me quer em seu coração Eu prefiro morrer Acabou Só não quero que a tristeza Afaste você de mim Nem desejo que o seu lindo olhar E o que lembrar você Me abandone Se o céu incandescer de uma vez Luz escorrer Tudo virar verão Me espere aqui Que eu vou ali Pegar Halley pra ti Volto pra ver Você correr Pra me dizer Que sim É Alagoas Quem dera nas suas águas Me banhar Muito mais Mas deixa isso Pra longe.
Muito Obrigado,/djavan/muito-obrigado.html,A Voz e o Violão,"Obrigado por tudo quanto Você me fez por nada Por nada se mata E morre de amor Não quero parecer com nada No mundo porque  Apesar da entranha ferida Donde eu saí pro nada Do nada também se nasce Uma flor com todo seu poder De colocação e magia  Tudo isso é uma questão de saber Saber viver Tudo isso é uma questão de amar Pra entender Tudo isso é uma questão de querer Reconhecer Que quem sabe tudo nada há de ser, nesse compasso Há espaço pra quem quiser viver  Muito obrigado Muito obrigado BIS Muito obrigado Por tudo que eu tenho passado   © 1976 BMG Music Publishing Brasil"
Mundo Vasto,/djavan/mundo-vasto.html,Vaidade,"Conta pra pagar a vida é o mesmo be-a-bá Um desalento nato Conto com você pra me salvar de me prender Ao que não for bom de fato Fico esperando a festa que é você chegando com o que há De bom e de melhor no prato Meu amor é você E viver lá no alto Sem o seu braço de paz o resto é medo Crise em cada canto quem já não vinha com tanto Sequer sobrou pro gasto Só você pra me tirar dessa cadeia de pezar Que assola esse mundo vasto Meu amor sem você O que posso esperar Ver a solidão da natureza só crescer ante a surdez do mundo Por segundo Menos bicho, menos água Quem manda bem Muito bem mas também paga Deus me fez nascer pra eu viver de um tudo   Tempo é muito vago e sem apoio O bicho é brabo O trigo é joio E quem quiser que se dê mal Com você na mão Como é que eu posso desdizer O que eu lhe disse sem parecer ingratidão   Tudo é muito vago e sem apoio O bicho é brabo O trigo é joio E quem quiser que se dê mal Com você na mão Como é que eu posso desdizer O que eu lhe disse sem parecer ingratidão  A cada segundo Menos bicho, menos água Quem manda bem Muito bem mas também paga Deus me fez nascer pra eu viver de um tudo  Tudo é muito vago e sem apoio O bicho é brabo O trigo é joio E quem quiser que se dê mal Com você na mão Como é que eu posso desdizer O que eu lhe disse sem parecer ingratidão  Tudo é muito vago e sem apoio O bicho é brabo O trigo é joio E quem quiser que se dê mal"
Na Boda do Beco,/djavan/na-boda-do-beco.html,A Voz e o Violão,"Na Boca Do Beco  Na hora da agonia, Eu pergunto: Cadê os meus amigos, meus camaradas, Meus parceiros? Na hora que eu mais necessito deles não acho um O Zé tá pra São Paulo E Pedro morreu, Até o Biu desapareceu Chico Careca, já cansei de bater na casa da esquina e nem Já é quase noite, e o negão num açoite Na boca do beco vai aparecer E eu vou ter que encarar E não posso perder, que a crioula vai ver Tomei decisão como último tiro Gritei num suspiro: ""Ganhei o bolão e não tenho um irmão Com quem possa gatar!"" De repentemente a turma pintou Com sorriso nos dentes Me dizendo contente: "" Ah! deixa isso com a gente!"" No final do barato eu ganhei do negão E, sem grana na mão a turma me ganhou Quando sacou o grupo E hoje a crioula está de luto No final do barato eu ganhei do negão E, sem grana na mão a turma me ganhou Quando sacou o grupo E hoje a crioula está de luto E hoje a crioula está de luto, ê! E hoje a crioula está de luto"
Nada a Nos Separar,/djavan/nada-a-nos-separar.html,Ária,"Mais uma vez, vou te esperar mais uma vez, não vou te ver chegar e eu tão triste, serei mais triste porque sei bem, que é vão te esperar  Porém minha lembrança, contigo estará e a esperança, reacenderá e um dia então, junto ao portão nosso lugar, irei te esperar  E tú virás de um mundo triste e ficarás pra sempre junto a mim e o sol da felicidade, de novo brilhará feliz serei, feliz serás até o fim  Se nossas tristezas, irão terminar sim livre seremos, nada irá nos separar Nossas horas tristes, de paz será enfim e as incertezas, direi fim, fim, fim  e um dia então, junto ao portão nosso lugar, irei te esperar  E tú virás de um mundo triste e ficarás pra sempre junto a mim e o sol da felicidade, de novo brilhará feliz serei, feliz serás até o fim"
Nada Mais Sou,/djavan/nada-mais-sou.html,D,"Te vi Fiquei só Ali Quase sem voz Não fui capaz Nem de um Oi, meu! Me deu Foi medo de te olhar Sei lá! E se ela nem Me vir Me ignorar Posso morrer De verdade Ou mais Nunca saberei O que é o amor Na terra Já não há mais lugar Passo a frequentar O desprazer Vou viver só por viver Sem existir Nada mais sou Se é que eu já fui Sem teu calor O que eu seria Mas a ilusão Que acendeu No coração A luz Não tem porque Se apagar Não"
Não Deu,/djavan/nao-deu.html,,"Eu sonhei viver Com você assim Tudo até o fim E no frio te proteger E te ver dormir E ali ficar Vivendo pra você Melhor viver De Deus usar a mão Te puxar pra lugar seguro Sempre que precisar Estar aqui pra te atender Te ouvir, te aconselhar, discutir Te livrar do escuro De um mundo real Mas, não deu Que mau... Eu sonhei viver Com você assim Dedicado a mim De tudo me proteger Pra me ver feliz a te agradar Contando histórias pra te ver sorrir Distrair, pensar no bem E ver a luz da vida se acender No amor dos braços teus Mas, não deu...   © 1996 Luanda Edições Musicais Ltda."
Não É Um Bolero,/djavan/nao-e-um-bolero.html,vidas pra contar,"Eu não digo que não Ela é bela e fera Mas não pondera E me deixa ""doindin""  Quando eu penso que sim Ela dá de ombro E eu me escombro ""sozin""  Se com ela há muito mais luar Porque viver dias sombrios? Eu não posso me distanciar E me perder dos seus carinhos Você é demais... Muito mais pra mim  Não é um bolero É amor sincero, que a tudo resiste Não a ter do lado, me deixa abalado E nada é mais triste A vida é atoa, não fica de boa Quem não tem um querer Eu tenho de tudo mas me falta tudo Se eu não tenho você"
Nas Ruas,/djavan/nas-ruas.html,Novena,"Meu olhar se mirando em teu olhar se eu pegar na mão , te beijarei te beijarei não consigo mais de vontade de ficar o que há entre eu e você é raro é na falta de ar do teu olhar que o sufoco crescerá eu sei, ora se sei! Não encontro mais nada pra me segurar tudo poderá acontecer é claro! Tempestade de negras e louras, morenas mouras todas elas a me voduzar desnudas bailam nas ruas e se vão nas luas do reflexo que sai da luz do teu olhar  eu te desejo e quero porque deus quer quem não quer é você que não tem fé em deus!   © 1994 Luanda Edições Musicais Ltda."
Navio,/djavan/navio.html,Não É Azul Mas É Mar,"Eu amei a sua cara venha cá é um prazer ouvi-la falar musical que nem um rio que navio é voce na praia que visìo é um abismo pro coração sim, pelo que vejoa voce é a mais bonita filha da manhã suave beijo em lábios de maçã queria saber o que toca você queria chegar e poder te alcançar eu quero dizer que eu queria você oh luz do querer minha vida é voce eu vou buscar o céu, o mar o que de mais bonito há pra te presentear o céu, o mar o que de mais bonito há."
Nem Um Dia,/djavan/nem-um-dia.html,Djavan - Novelas,"Um dia frio Um bom lugar pra ler um livro E o pensamento lá em você, Eu sem você não vivo Um dia triste Toda fragilidade incide E o pensamento lá em você, E tudo me divide  Longe da felicidade E todas as suas luzes Te desejo como ao ar Mais que tudo, És manhã na natureza das flores  Mesmo por toda riqueza Dos sheiks árabes Não te esquecerei um dia, Nem um dia Espero com a força do pensamento Recriar a luz que me trará você.  E tudo nascerá mais belo, O verde faz do azul com o amarelo O elo com todas as cores Pra enfeitar amores gris.   © 1996 Luanda Edições Musicais Ltda."
Nereci,/djavan/nereci.html,,Nereci.... Quando o mar levou Teria sido traição Será que Na maré de hoje Ela virá Rainha do mar Além de Todos além Além do mar Além do além mar Nereci além Do azul estará  © copyright 1978 Warner / Chappell
Num Mundo de Paz,/djavan/num-mundo-de-paz.html,D,"Vem ver a tarde, amor Nunca tal esplendor Fez-se notar com tanta resolução Vem que o anil do amor E o sangue da paixão Vão ostentar usando de toda cor  E aí pensar em tudo que se vai fazer E avaliando o entorno das coisas Abstrair o que só nos faz perder Pra que você possa me olhar  E querer tudo de novo E contar com o que vai ter E no sal de um beijo novo Ter motivo pra viver Belas noites de verão De mãos dadas por aí Retomar o que era bom Mas se não quiser sair  Deixar Que o vento leve E o amor Se encarregue de tudo  E que a gente volte a rir de tudo E que a vida seja longa e tudo Num mundo de paz  E que a gente volte a rir de tudo E que a vida seja longa e tudo Num mundo de paz  Vem ver a tarde, amor Nunca tal esplendor Fez-se notar com tanta resolução Vem que o anil do amor E o sangue da paixão Vão ostentar usando de toda cor  E aí pensar em tudo que se vai fazer E avaliando o entorno das coisas Abstrair o que só nos faz perder Pra que você possa me olhar  E querer tudo de novo E contar com o que vai ter E no sal de um beijo novo Ter motivo pra viver Belas noites de verão De mãos dadas por aí Retomar o que era bom Ser feliz é logo ali  E querer tudo de novo E contar com o que vai ter E no sal de um beijo novo Ter motivo pra viver Belas noites de verão De mãos dadas por aí Retomar o que era bom Ser feliz é logo ali  E querer tudo de novo E contar com o que vai ter E no sal de um beijo novo Ter motivo pra viver Belas noites de verão De mãos dadas por aí Retomar o que era bom Ser feliz é logo ali"
Numa Esquina de Hanói,/djavan/numa-esquina-de-hanoi.html,,"Um é par de dois Quer ver, verás Irei a ti pra viver Depois morrer de paz Ou não... Quem saberá? Ficarei sabedor se você temperou no sal Ou se salobro nós Me atiro, cívico Aos meus amigos de varar a noite Trazás nó cego, dirás E eu rirei, pecador No que você corará mais E de cor entregarás A minha alma viva e depenada para o satanás Que enfim, quiçá lhe trai indiferente a mim Que não lhe significa nada mais do que um lobo atroz Perdido numa esquina de Hanói Perdido numa esquina de Hanói   © Copyright by BMG Arabella"
Nuvem Negra,/djavan/nuvem-negra.html,,Não adianta me ver sorrir Espelho meu Meu riso é seu Eu estou ilha ... da Hoje não ligo a TV Nem mesmo pra ver o Jô Não vou sair Se ligarem não estou À manhã que vem Nem bom-dia eu vou dar Se chegar alguém A me pedir um favor Eu não sei  Tá difícil ser eu Sem reclamar de tu ...do Passa nuvem negra Larga o dia E vê se leva o mal Que me arrasou Pra que não faça sofrer mais ninguém Esse amor que é raro E é preciso Pra nos levantar Me derrubou nao sabe parar de crescer e doer
O Tal do Amor,/djavan/o-tal-do-amor.html,vidas pra contar,"Me vejo ao seu lado Com o ego inflado Eu vivo a querer O seu amor Seja como for Teu beijo ardente Não sai da mente E o meu coração Não sabe o que é ilusão Se eu lhe chamar Você não olhar Vai me pesar, mas voa E eu espero “na boa” Sorrir pra mim É quase um jardim Onde pássaros voam E entidades atuam Pro bem querer o bem Se unificar E assombrar a dor Pra estarmos juntos Em nome do tal Do amor"
O Vento,/djavan/o-vento.html,,"Minha mulher, minha irmã Minha cara metade De carne maçã, maçã Minha costela- de-Adão Meu pé de romã, romã Vento que bate na porta Trazendo notícias Que tem de alguém Vento que entorna a manhã Do meu bem Me leva, me leva Vento Bate suas asas Voa sobre as casas Vento faz o dia delirar Traz minha morena do além- mar Minha irmã, meu irmão Quem tem ouro na pele Da alma pagã, pagã Vento me ensina a tocar A flauta de Pã, de Pã   © 1987 Luanda Edições Musicais Ltda. Três Pontas"
Oceano,/djavan/oceano.html,Djavan - Novelas,Assim Que o dia amanheceu Lá no mar alto da paixão Dava pra ver o tempo ruir Cadê você? Que solidão! Esquecera de mim  Enfim De tudo que há na terra Não há nada em lugar nenhum Que vá crescer sem voce chegar Longe de ti tudo parou Ninguém sabe o que eu sofri  Amar é um deserto E seus temores Vida que vai na sela Dessas dores Não sabe voltar Me dá teu calor  Vem me fazer feliz Porque eu te amo Você deságua em mim E eu oceano Esqueço que amar É quase uma dor Só sei Viver Se for Por você   © 1989 Luanda Edições Musicais Ltda.
Om,/djavan/om.html,Milagreiro,"Eu já nem sei quem sou tão dedicado a ti um cobertor pro frio queria ser teu ""om"" viver grudado, sim sempre ali, sempre ali não sou nada indelével sou instável como a cidade mas carrego pau e pedra só para ver-te mais à vontade sem o mar a cobrir-te de sombras ou cores livre pra amores desses que vêm e vão sob o bronze da noite onde o mais são estrelas todas ali para vê-la como fazer com os homens ah! você que nasceu com o leito pro rio que desafio querer-te acompanhar!...   © 1992 Luanda Edições Musicais Ltda."
Oração Ao Tempo,/djavan/oracao-ao-tempo.html,Ária,És um senhor tão bonito Quanto a cara do meu filho Tempo tempo tempo tempo Vou te fazer um pedido Tempo tempo tempo tempo...  Compositor de destinos Tambor de todos os rítmos Tempo tempo tempo tempo Entro num acordo contigo Tempo tempo tempo tempo...  Por seres tão inventivo E pareceres contínuo Tempo tempo tempo tempo És um dos deuses mais lindos Tempo tempo tempo tempo...  Que sejas ainda mais vivo No som do meu estribilho Tempo tempo tempo tempo Ouve bem o que te digo Tempo tempo tempo tempo...  Peço-te o prazer legítimo E o movimento preciso Tempo tempo tempo tempo Quando o tempo for propício Tempo tempo tempo tempo...  De modo que o meu espírito Ganhe um brilho definido Tempo tempo tempo tempo E eu espalhe benefícios Tempo tempo tempo tempo...  O que usaremos prá isso Fica guardado em sigilo Tempo tempo tempo tempo Apenas contigo e comigo Tempo tempo tempo tempo...  E quando eu tiver saído Para fora do teu círculo Tempo tempo tempo tempo Não serei nem terás sido Tempo tempo tempo tempo...  Ainda assim acredito Ser possível reunirmo-nos Tempo tempo tempo tempo Num outro nível de vínculo Tempo tempo tempo tempo...  Portanto peço-te aquilo E te ofereço elogios Tempo tempo tempo tempo Nas rimas do meu estilo Tempo tempo tempo tempo...
Orquídea,/djavan/orquidea.html,Vesúvio,"Lembra aquela Phalaenopsis Que você me deu Me deixou com Sophronitis Por um beijo seu  Pleurothallis, Paphiopedilum Cores demais Nada comum  Cyrtopodium, Sarcoglottis De um bem-querer Fui à Brassia na Malaxis Mas não vi você Amabilis, Violácea-me aqui Javanica, Guttata-me  Cattleya ou Purpurata Me remete a você Uma Brassavola nata Seu labelo bicolor Desacata Pela fragrância da cor  Sépala, labelo, coluna E pétala tem a flor Flor que nasce, cresce E flora por amor"
Outono,/djavan/outono.html,Djavan - Novelas,"Um olhar uma luz ou um par de pérolas mesmo sendo azuis sou teu e te devo por essa riqueza uma boca que eu sei não porque me fala lindo e sim, beija bem tudo é viável pra quem faz com prazer sedução, frenesi sinto você assim sensual, árvore espécie escolhida pra ser a mão do ouro o outono traduzir viver o esplendor em si tua pele um bourbon me aquece como eu quero sweet home gostar é atual além de ser tão bom.   © 1992 Luanda Edições Musicais Ltda."
Palco,/djavan/palco.html,Ária,"Subo nesse palco, minha alma cheira a talco Como bumbum de bebê, de bebê Minha aura clara, só quem é clarividente pode ver Pode ver Trago a minha banda, só quem sabe onde é Luanda Saberá lhe dar valor, dar valor Vale quanto pesa prá quem preza o louco bumbum do tambor Do tambor  Fogo eterno prá afugentar O inferno prá outro lugar Fogo eterno prá consumir O inferno, fora daqui  Venho para a festa, sei que muitos têm na testa  O deus-sol como um sinal, um sinal Eu como devoto trago um cesto de alegrias de quintal  De quintal  Há também um cântaro, quem manda é Deus a música  Pedindo prá deixar, prá deixar Derramar o bálsamo, fazer o canto, cantar o cantar  Lá, lá, iá"
Para Comigo Fazer,/djavan/para-comigo-fazer.html,,"Já é tarde E não vou mais dormir Eu vou sair sem direção talvez Na escuridão, eu possa ver alguém feliz Eu quero ver à toa Ao menos uma pessoa, numa boa Por aí Para comigo fazer para comigo poder até conversar Sobre coisas esquecidas Pelo desuso da boca Ou pela fala vencida Para comigo lembrar para comigo dançar ao som da retreta dos grilos a pernear os dois A poder tudo Antes que o dia amanheça E acordem todos, todos Para comigo parar   © 1978 Warner / Chappell"
Pára-Raio,/djavan/para-raio.html,A Voz e o Violão,"Descalço num pequeno espaço Deitado em quarto crescente Pálido, cálido, espírito ausente Calado , de corpo fechado Não traço, não sigo, não sou obrigado Não faço segredo, não sou bem dotado Cabeça feita, visão na estrada Esqueço do medo, não choro por nada No braço do mar, bem na ponta d’areia A terra treme, o tempo serra Quem manda na chuva é o vento Quem manda na chuva é o vento  E pára-raio Cata-vento E pára-raio Cata-vento E pára-raio E pára o tempo E pára E pára-raio Cata-vento   © Copyright by Ed.Musical BMG Arabella Ltda"
Pássaro,/djavan/passaro.html,Bicho Solto - O XIII,"Vem me dar teu calor Que eu te dou meu carinho Como faz a flor com o beija-flor Ou o pão e o vinho Minhas juras de amor Teus cuidados comigo Na paz dos teus braços Pena de ave, campos de trigo E chego a levitar Quando estou te olhando  Pássaro voa e vai pela beira do rio E deixo de pensar no que é desengano E reparo só nos desafios Com a graça de deus menino É que eu me guio ""rogai por nós, vos peço paz! "" Nos una mais, não nos deixe sós E se não for pedir de mais Quaro vida normal e algum dinheiro Deitar, dormir, poder sonhar Que um dia eu vá conhecer o sul  Que chova aqui o que chove lá Para o que se plantar ganhar o verde Pra alimentar, pra garantir O bem-estar de viver sem medo E ter pra quando precisar E não ter que ficar chupando o dedo Da criação, dos pés de coco A fruta-pão quero ver crescer Realizar a ilusão  Para o meu coração se aquecer Se eu deixar de ter você É como não ter mais o que esperar Ou sei lá o quê, deixar de ser Flamengo, mengo Ah, se eu perder você É quase não mais poder respirar Ou pirar de vez e não ser mais Flamengo, mengo, mengo"
Passou,/djavan/passou.html,Bicho Solto - O XIII,"Preciso sair Distrair um pouco Ser içado ao mundo Do fundo do poço Reaparecer Com a tarde ainda Porque o que passou, passou Nada é para toda a vida Tudo o que eu vivi É passado, escombros Deixo os seus jardins E afins para os pombos Pronto para seguir Ticket só de ida Outro lugar, um outro amor Uma outra cor na vida Nunca mais outras noites Vão me seguir de madrugada Sua lembrança já não me faz nada Sair pro sol Ver a ponte se abrir Sorrir de tudo Desencanar 'Cê sabe ser fria Tanto quanto a Suécia E eu o Brasil das matas tropicais Mares de verão, cascatas de foz Luar do sertão E levo a vida bem melhor Seguindo meu coração"
Pecado,/djavan/pecado.html,Rua dos Amores,"Quero ficar pensando Quase me abandonando Com pouco, a me ligar Há sinais de vida em construcao  Nenhuma nuvem nada Tempo de água parada Alma quer navegar Mas ela 'tá que fala, fala, fala...  Pecado, pecado, pecado Quer mudar tudo, tudo... Pecado  E passarinho que canta Flora de encantos mil Sonhos e catedrais Para longa espera dos cordeiros  Mesmo que o amor avance Perde-se em nuance Quase um Chile inteiro Quando voce fala, fala, fala...  Pecado, pecado, pecado, pecado  Quer viver de amor? Vá! Mas pode parar com esse pantim, Ouça mais para variar E saber mais de mim  Pecado, pecado, pecado, pecado  Voce está sempre a mais, Nao tem mais medida. E a bem dizer: Insatisfaz No entanto, mulher mais querida Esta para nascer  E passarinho que canta Flora de encantos mil Sonhos e catedrais Para longa espera dos cordeiros  Mesmo que o amor avance Perde-se em nuance Quase um Chile inteiro Quando você fala, fala, fala...  Pecado, pecado, pecado, pecado  Quer viver de amor? Vá Mas pode parar com esse pantim, Ouça mais para variar E saber mais de mim  Pecado, pecado, pecado, pecado"
Pedra,/djavan/pedra.html,Matizes,"Sede de amor Febre de anseio Quase a escuridão Você partiu, me reduziu, Amor, me perco em lágrimas Não mais a vi, desde abril, fui pro mar E você lá deitada na pedra. Que inveja dessa pedra O que ficou, eu compreendi, Face àquela visão O que era amor inda me diz: Pena que tudo acabe... Um lance novo me despertou Desde já, só quero estar Com quem me serve E, de resto, serei breve! Nada fica em pé Pra quem se quebra numa paixão. O mundo é vão E tudo é só um oco absurdo Não mais me vejo assim Tô a pé, mas chego onde vou Revê-la só foi ruim Porque nada me causou Doeu, me ressenti Quando você me desprezou Mas hoje estou aqui: Algo como uma flor na pedra Preste a nascer.  (fonte: site oficial)"
Pedro Brasil,/djavan/pedro-brasil.html,Seduzir,"Sorria para mim, meu brasil assim, ria largo do fundo, aqui ria aqui do nada não vá trair o seu dom de cair de pé logo agora que eu escrevi uma canção de fé atenção: quem descobriu o brasil foi pedro quem libertou o brasil foi pedro quem construiu o brasil foi pedro quem descobriu... Quem libertou... Quem contruiu... Quem já viu tanto pedro viver assim... Feito coisa ruim, no are bem fez pedro lá no céu que aprendeu chover, estiar e hoje tem grande poder pra lá mas nada pode aqui mas nada pode aqui mas nada pode aqui mas nada pode aqui   © 1981 Edições Musicais Tapajós Ltda. (EMI)"
Pétala,/djavan/petala.html,Ao Vivo - Vols. 1 e 2,"O seu amor Reluz Que nem riqueza Asa do meu destino Clareza do tino P étala De estrela caindo Bem devagar Ó meu amor Viver É todo sacrifício Feito em seu nome Quanto mais desejo Um beijo seu Muito mais eu vejo Gosto em viver, viver...  Por ser exato O amor não cabe em si Por ser encantado O amor revela-se Por ser amor Invade E fim.   © 1982 Luanda Edições Musicais Ltda."
Pode Esquecer,/djavan/pode-esquecer.html,Rua dos Amores,"Em algum lugar, Onde se pode Esperar pelo melhor, Onde cada ser Se viu crescer Cheio de planos Pra servir, Vida só há de ter Quem a dividir! Ser alguém Por fazer mais! Não se pode ir além Nas costas de ninguém, Por amor, como for, vai. Na nova ordem geral De um novo comando, Abstinência moral É crime hediondo! Aquela onda de caos Que sai varrendo o mar Dos que têm poder, Pode esquecer! Só procedimentos normais, O mais é injúria. E tudo se liquefaz, Num mar de candura. Se alguém tiver que arbitrar Só vai poder contar Com o delírio de um cantor: O que se passou, passou Prescreveu!... O amanhã ficou pra bem distante, O hoje com a mesma cara de ontem E a vida segue em frente, ardilosamente a mil."
